{
  "$schema": "https://snarked.com/schemas/recipop-recipe.schema.json",
  "id": "zaatar-salmon-tahini",
  "title": "Za'atar Salmon & Tahini",
  "subtitle": "Salmon baked over wilted greens with za'atar, sumac, lemon, and tahini",
  "source": {
    "submittedBy": "Food52 / Ottolenghi Test Kitchen",
    "date": "2026-05-12",
    "file": "recipe.md",
    "url": "https://food52.com/recipes/86926-sauteed-salmon-recipe-with-tahini-greens"
  },
  "assetBasePath": "assets",
  "unitSystems": [
    {
      "id": "original",
      "label": "Original"
    },
    {
      "id": "metric",
      "label": "Metric"
    }
  ],
  "defaultUnitSystem": "metric",
  "quickFacts": [
    {
      "label": "Serves",
      "value": "4"
    },
    {
      "label": "Prep",
      "value": "~5 min"
    },
    {
      "label": "Cook",
      "value": "~20 min"
    },
    {
      "label": "Heat",
      "value": "450 F"
    },
    {
      "label": "Stations",
      "value": "stovetop + oven"
    }
  ],
  "imageGeneration": {
    "model": "openai/gpt-5.4-image-2",
    "imageSize": "1K",
    "defaultAspectRatio": "4:3",
    "referenceMode": "image"
  },
  "storyboard": {
    "id": "recipe-continuity-storyboard",
    "filename": "storyboard-zaatar-salmon-tahini.png",
    "placement": "Continuity storyboard",
    "alt": "Za'atar Salmon & Tahini visual continuity storyboard",
    "aspectRatio": "16:9",
    "intent": "Generate this first as one coherent white-background continuity board for reusable ingredients, cookware, intermediate states, and final serving. Later hero and step images should match its cookware, camera angle, repeated ingredients, cooked states, palette, and lighting. It is not a thumbnail sheet of final step images.",
    "camera": "Use one consistent three-quarter overhead recipe-card perspective for every object: slightly above the food, looking down at a shallow angle, with pan handles and bowl ellipses oriented consistently left-to-right. Keep objects centered with comfortable padding and a clean white-paper background.",
    "cookware": [
      {
        "name": "large oven-safe saute pan",
        "description": "Wide shallow pan that can move from stovetop to oven; use the same pan for wilted greens, salmon first bake, tahini finish bake, and final serving state."
      },
      {
        "name": "small spice bowl",
        "description": "Small bowl for the za'atar-sumac mixture; preserve bowl material and angle if it appears again."
      },
      {
        "name": "small sauce bowl and whisk",
        "description": "Small bowl with whisk for tahini, garlic, lemon, water, and salt; use this for the tahini sauce step."
      },
      {
        "name": "oven",
        "description": "Same implied oven environment for preheat and bake stages; use warm interior glow without drawing numbers or labels."
      }
    ],
    "inventory": [
      {
        "name": "salmon fillets",
        "description": "4 skin-on salmon fillets, raw and patted dry; later become za'atar-crusted salmon, salmon over greens, baked salmon with bubbling tahini, and finished plated salmon."
      },
      {
        "name": "za'atar and sumac crust",
        "description": "Green-brown herb spice crust made from za'atar and sumac, visibly coating only the top of the salmon."
      },
      {
        "name": "olive oil",
        "description": "Used in three portions: wilt greens, drizzle salmon before first bake, and finish the dish."
      },
      {
        "name": "baby spinach or tender greens",
        "description": "Loose green leaves that wilt into a bed in the saute pan."
      },
      {
        "name": "tahini sauce",
        "description": "Pale beige, smooth, runny tahini sauce whisked with garlic, lemon juice, salt, and water."
      },
      {
        "name": "lemon, cilantro, and extra sumac",
        "description": "Fresh finishing elements; lemon juice and oil gloss the dish, cilantro and sumac add green and red-purple accents."
      },
      {
        "name": "wilted greens",
        "description": "stovetop result: greens softened in the oven-safe saute pan."
      },
      {
        "name": "za'atar-crusted salmon",
        "description": "seasoning result: salmon fillets with a visible herb-spice crust on top."
      },
      {
        "name": "salmon over wilted greens",
        "description": "first bake state: salmon fillets arranged skin-side down over wilted greens in the same saute pan."
      },
      {
        "name": "baked salmon with bubbling tahini",
        "description": "finish bake state: tahini poured around, not over, the fish; sauce bubbles at the edges around the salmon."
      },
      {
        "name": "za'atar salmon and tahini greens",
        "description": "final state with lemon, olive oil, cilantro, and extra sumac on top."
      }
    ],
    "stateMap": [
      {
        "name": "za'atar-crusted salmon",
        "description": "From raw salmon plus za'atar, sumac, salt, and pepper; keep the top crust color and texture consistent wherever it appears."
      },
      {
        "name": "wilted greens",
        "description": "From baby spinach cooked briefly in olive oil; keep the greens in the same wide saute pan."
      },
      {
        "name": "salmon over wilted greens",
        "description": "From za'atar-crusted salmon placed over wilted greens and drizzled with olive oil."
      },
      {
        "name": "runny tahini sauce",
        "description": "From tahini, garlic, lemon juice, water, and salt; pale beige and pourable, not thick paste."
      },
      {
        "name": "baked salmon with bubbling tahini",
        "description": "From salmon over greens plus tahini sauce; keep tahini around the fish, not hiding the spice crust."
      },
      {
        "name": "za'atar salmon and tahini greens",
        "description": "Final garnished dish; same pan and same salmon arrangement, finished with cilantro and sumac."
      }
    ],
    "sequenceNotes": [
      "Step 1, Preheat Oven: warm oven to 450 F while the first prep happens.",
      "Step 2, Season Salmon: dry salmon, season, and crust the tops with za'atar and sumac.",
      "Step 3, Wilt Greens: cook greens briefly in olive oil in the oven-safe saute pan.",
      "Step 4, First Bake: place salmon over greens, drizzle oil, and bake 5 minutes.",
      "Step 5, Whisk Tahini Sauce: during the 5-minute first bake, whisk tahini, garlic, lemon, salt, and water.",
      "Step 6, Finish Bake: pour tahini around salmon and bake until fish is cooked and sauce bubbles.",
      "Step 7, Garnish and Serve: finish with lemon juice, olive oil, cilantro, and extra sumac."
    ],
    "continuityRules": [
      "This storyboard is art only; do not include labels, numbers, arrows, UI cards, ingredient text, captions, panels, thumbnail frames, or visible text.",
      "Pick a single coherent cookware set and keep it fixed across the recipe: same pan shapes, dish shapes, bowls, cutting board, and serving vessel whenever repeated.",
      "Show repeated food states clearly enough that individual step images can reuse them without changing color, cut size, doneness, or vessel.",
      "Use the same lighting direction, paper tone, shadows, scale, and three-quarter camera angle across all later assets.",
      "Make one coherent white-background still-life/inventory board of reusable elements, not a contact sheet, comic strip, diagram, timeline, or set of final per-step images."
    ],
    "prompt": "Create one unlabeled visual continuity board for Za'atar Salmon & Tahini. Show the final dish, main raw ingredients, intermediate mixtures or cooked states, repeated tools/stations, and serving/garnish elements that appear in the recipe as one coherent hand-painted recipe-world reference on clean white paper. Arrange the elements in loose process order only enough to help continuity; do not draw a timeline, flowchart, labels, text, arrows, UI, frames, panels, or a grid of step thumbnails. Make cookware choices explicit through the art itself so repeated pans, bowls, dishes, boards, and tools can be reused consistently in later images."
  },
  "heroAssets": [
    "hero-zaatar-salmon-tahini.png"
  ],
  "layout": {
    "type": "vertical-process",
    "sections": [
      {
        "type": "step",
        "step": "preheat-oven"
      },
      {
        "type": "step",
        "step": "season-salmon"
      },
      {
        "type": "step",
        "step": "wilt-greens"
      },
      {
        "type": "parallel",
        "summary": "While the pan bakes, whisk the tahini sauce.",
        "lanes": [
          {
            "label": "Oven",
            "accent": "cook",
            "steps": [
              "first-bake"
            ]
          },
          {
            "label": "Counter",
            "accent": "prep",
            "steps": [
              "whisk-tahini-sauce"
            ]
          }
        ],
        "converge": {
          "label": "Tahini sauce joins the pan for the finish bake.",
          "targetStep": "finish-bake"
        }
      },
      {
        "type": "step",
        "step": "finish-bake"
      },
      {
        "type": "step",
        "step": "garnish-and-serve"
      }
    ]
  },
  "steps": [
    {
      "id": "preheat-oven",
      "number": 1,
      "timeLabel": "0 min",
      "phase": "setup",
      "title": "Preheat Oven",
      "instruction": "Preheat the oven to 450 F.",
      "duration": {
        "activeMinutes": 1,
        "activeLabel": "1 minute",
        "passiveLabel": "heats while you prep"
      },
      "resources": [
        "oven"
      ],
      "ingredients": [],
      "makes": [],
      "notes": [
        "Let the oven heat while you season the fish and wilt the greens."
      ],
      "asset": "step-01-preheat-oven.png"
    },
    {
      "id": "season-salmon",
      "number": 2,
      "timeLabel": "0 min",
      "phase": "prep",
      "title": "Season Salmon",